{
  "schema_version": "0.2.0",
  "graph_version": "0.2.9",
  "generated_at": "2026-09-08T10:39:57Z",
  "source_files": [
    "concepts/physical-concepts.json",
    "concepts/relations.json",
    "concepts/semantic-concepts.json",
    "concepts/target-patterns.json",
    "concepts/unmodeled-effects.json"
  ],
  "concepts": [
    {
      "concept_id": "activity.dancing",
      "label": "Dancing activity",
      "module": "semantic_role",
      "concept_type": "activity",
      "human_meaning": "The entity is dancing.",
      "status": "draft"
    },
    {
      "concept_id": "activity.examining",
      "label": "Examining activity",
      "module": "semantic_role",
      "concept_type": "activity",
      "human_meaning": "The entity is examining a subject or patient.",
      "status": "draft"
    },
    {
      "concept_id": "anatomy.ear.pointed",
      "label": "Pointed ears",
      "module": "entity_identity",
      "concept_type": "body_part_configuration",
      "human_meaning": "The visible ears have pointed tips.",
      "status": "draft"
    },
    {
      "concept_id": "anatomy.ear.rounded_human",
      "label": "Rounded human ears",
      "module": "entity_identity",
      "concept_type": "body_part_configuration",
      "human_meaning": "The ears use a conventional rounded human form.",
      "status": "draft"
    },
    {
      "concept_id": "anatomy.lower_body.mermaid_tail",
      "label": "Mermaid lower body",
      "module": "entity_identity",
      "concept_type": "body_part_configuration",
      "human_meaning": "The lower body is transformed into a mermaid tail.",
      "status": "draft"
    },
    {
      "concept_id": "body.orientation.face_up",
      "label": "Face-up orientation",
      "aliases": [
        "face up",
        "supine orientation"
      ],
      "module": "physical",
      "concept_type": "body_orientation",
      "human_meaning": "The front of the body is oriented upward.",
      "scope": [
        "body"
      ],
      "status": "provisional"
    },
    {
      "concept_id": "body.proportion.slender",
      "label": "Slender proportions",
      "module": "entity_identity",
      "concept_type": "body_part_configuration",
      "human_meaning": "The body has slender proportions.",
      "status": "draft"
    },
    {
      "concept_id": "body.state.lying",
      "label": "Lying body state",
      "aliases": [
        "lying",
        "lying down"
      ],
      "module": "physical",
      "concept_type": "body_state",
      "human_meaning": "The body is primarily in a lying state.",
      "scope": [
        "body"
      ],
      "evidence_refs": [
        {
          "evidence_ref_id": "evidence.brg007a.lying",
          "run_id": "BRG-007-A",
          "observation_path": "experiments/bridge/BRG-007-A/observation.json",
          "research_packet_path": "reports/BRG-007_research-packet.pdf",
          "metric": "computed_aggregate.axis_counts.body_state.lying",
          "count": 6,
          "total": 6,
          "confidence": "high",
          "storage": "local"
        }
      ],
      "status": "provisional"
    },
    {
      "concept_id": "body.state.reclined",
      "label": "Reclined body state",
      "aliases": [
        "reclined"
      ],
      "module": "physical",
      "concept_type": "body_state",
      "human_meaning": "The torso is leaned back while remaining partly elevated.",
      "scope": [
        "body",
        "upper_torso"
      ],
      "status": "provisional"
    },
    {
      "concept_id": "camera.angle.eye_level",
      "label": "Eye-level camera angle",
      "aliases": [
        "eye level"
      ],
      "module": "camera",
      "concept_type": "camera",
      "human_meaning": "A camera viewpoint positioned approximately level with the subject, producing a visibly level viewing direction without a dominant upward or downward angle.",
      "scope": [
        "camera_vertical_angle",
        "subject"
      ],
      "model_behaviors": [
        {
          "model_profile_id": "model.novaanimexl_ilv190",
          "observed_behavior": "CAM-006-A produced eye-level vertical-position evidence in 4/6 panels under the tested neutral prompt context. Matched eye-level-to-low-angle and eye-level-to-high-angle comparisons were directionally discriminated in 5/6 pairs each; this does not establish fully stable eye-level behavior or full three-way discrimination.",
          "status": "provisional",
          "evidence_refs": [
            {
              "evidence_ref_id": "evidence.cam006a.observed_eye_level",
              "run_id": "CAM-006-A",
              "observation_path": "experiments/camera/CAM-006-A/observation.json",
              "metric": "computed_aggregate.axis_counts.apparent_camera_vertical_position.eye_level",
              "count": 4,
              "total": 6,
              "confidence": "medium",
              "storage": "local"
            },
            {
              "evidence_ref_id": "evidence.cam006b.low_angle_for_eye_level_comparison",
              "run_id": "CAM-006-B",
              "observation_path": "experiments/camera/CAM-006-B/observation.json",
              "metric": "computed_aggregate.axis_counts.apparent_camera_vertical_position.below_subject",
              "count": 6,
              "total": 6,
              "confidence": "high",
              "storage": "local"
            },
            {
              "evidence_ref_id": "evidence.cam006c.high_angle_for_eye_level_comparison",
              "run_id": "CAM-006-C",
              "observation_path": "experiments/camera/CAM-006-C/observation.json",
              "metric": "computed_aggregate.axis_counts.apparent_camera_vertical_position.above_subject",
              "count": 6,
              "total": 6,
              "confidence": "high",
              "storage": "local"
            }
          ]
        }
      ],
      "status": "provisional"
    },
    {
      "concept_id": "camera.angle.high_angle",
      "label": "High camera angle",
      "aliases": [
        "high angle"
      ],
      "module": "camera",
      "concept_type": "camera",
      "human_meaning": "A camera viewpoint visibly above the subject with a downward viewing direction.",
      "scope": [
        "camera_vertical_angle",
        "subject"
      ],
      "model_behaviors": [
        {
          "model_profile_id": "model.novaanimexl_ilv190",
          "observed_behavior": "CAM-006-C produced above-subject vertical-position evidence in 6/6 panels under the tested neutral prompt context. The matched eye-level-to-high-angle comparison was directionally discriminated in 5/6 pairs, and low-angle versus high-angle opposite evidence was discriminated in 6/6 pairs.",
          "status": "provisional",
          "evidence_refs": [
            {
              "evidence_ref_id": "evidence.cam006c.observed_high_angle",
              "run_id": "CAM-006-C",
              "observation_path": "experiments/camera/CAM-006-C/observation.json",
              "metric": "computed_aggregate.axis_counts.apparent_camera_vertical_position.above_subject",
              "count": 6,
              "total": 6,
              "confidence": "high",
              "storage": "local"
            },
            {
              "evidence_ref_id": "evidence.cam006a.eye_level_for_high_angle_comparison",
              "run_id": "CAM-006-A",
              "observation_path": "experiments/camera/CAM-006-A/observation.json",
              "metric": "computed_aggregate.axis_counts.apparent_camera_vertical_position.eye_level",
              "count": 4,
              "total": 6,
              "confidence": "medium",
              "storage": "local"
            },
            {
              "evidence_ref_id": "evidence.cam006b.low_angle_for_high_angle_comparison",
              "run_id": "CAM-006-B",
              "observation_path": "experiments/camera/CAM-006-B/observation.json",
              "metric": "computed_aggregate.axis_counts.apparent_camera_vertical_position.below_subject",
              "count": 6,
              "total": 6,
              "confidence": "high",
              "storage": "local"
            }
          ]
        }
      ],
      "status": "provisional"
    },
    {
      "concept_id": "camera.angle.low_angle",
      "label": "Low camera angle",
      "aliases": [
        "low angle"
      ],
      "module": "camera",
      "concept_type": "camera",
      "human_meaning": "A camera viewpoint visibly below the subject with an upward viewing direction.",
      "scope": [
        "camera_vertical_angle",
        "subject"
      ],
      "model_behaviors": [
        {
          "model_profile_id": "model.novaanimexl_ilv190",
          "observed_behavior": "CAM-006-B produced below-subject vertical-position evidence in 6/6 panels under the tested neutral prompt context. The matched eye-level-to-low-angle comparison was directionally discriminated in 5/6 pairs, and low-angle versus high-angle opposite evidence was discriminated in 6/6 pairs.",
          "status": "provisional",
          "evidence_refs": [
            {
              "evidence_ref_id": "evidence.cam006b.observed_low_angle",
              "run_id": "CAM-006-B",
              "observation_path": "experiments/camera/CAM-006-B/observation.json",
              "metric": "computed_aggregate.axis_counts.apparent_camera_vertical_position.below_subject",
              "count": 6,
              "total": 6,
              "confidence": "high",
              "storage": "local"
            },
            {
              "evidence_ref_id": "evidence.cam006a.eye_level_for_low_angle_comparison",
              "run_id": "CAM-006-A",
              "observation_path": "experiments/camera/CAM-006-A/observation.json",
              "metric": "computed_aggregate.axis_counts.apparent_camera_vertical_position.eye_level",
              "count": 4,
              "total": 6,
              "confidence": "medium",
              "storage": "local"
            },
            {